Title,Link,Keywords,Resumen,Importancia
"Data for characterization of SALK_084889, a T-DNA insertion line of Arabidopsis thaliana",https://www.ncbi.nlm.nih.gov/pmc/articles/PMC5470433/,data for characterization salk 084889 t dna,"This article reports the identification of T-DNA insertion sites in the 3â€² UTR regions of the DREB2A gene and the LOX1 gene promoter in the genome of the Arabidopsis mutant line SALK_084889, verified by DNA PCR and Sanger sequencing. The expression levels of DREB2A and LOX1 were analyzed using qPCR, and drought and heat tolerance were compared between the mutant line and the wild type. The results indicate that DREB2A expression in SALK_084889 does not decrease under normal conditions but can be affected in roots under drought, whereas LOX1 is significantly downregulated in roots and shoots under all conditions tested. These original data are valuable for the genetic and mutation analysis of DREB2A and LOX1.",7
Genetic dissection of the Arabidopsis spaceflight transcriptome: Are some responses dispensable for the physiological adaptation of plants to spaceflight?,https://www.ncbi.nlm.nih.gov/pmc/articles/PMC5491145/,"genetic, dissection, arabidopsis, spaceflight, transcriptome, are","The CARA experiment, conducted on the International Space Station, investigated the adaptation of *Arabidopsis* plants to the space environment, focusing on whether the observed transcriptomic responses are necessary or if some are non-adaptive and costly. Comparing root tips of two *Arabidopsis* ecotypes (Col-0 and WS) and a Col-0 PhyD mutant, the study found that the PhyD mutant and the WS genotype exhibited significantly reduced transcriptomic responses in space under ambient light. This suggests that manipulating a single gene or the genotype can enhance adaptation by reducing the physiological cost. Furthermore, the space lighting environment influenced the magnitude of these responses, indicating that genetic and local habitat manipulations could substantially reduce the metabolic cost of adapting to spaceflight. The study raises the possibility that, in an environment outside their evolutionary history, plants may activate non-adaptive responses that could be genetically eliminated without compromising survival.",9
Phenotypic characterization of an Arabidopsis T-DNA insertion line SALK_063500,https://www.ncbi.nlm.nih.gov/pmc/articles/PMC5996828/,"phenotypic characterization, arabidopsis, dna, insertion, line","This article reports the identification of a homozygous lethal line with a T-DNA insertion in the coding region of the At1G05290 gene in the plant *Arabidopsis thaliana* (line SALK_063500). The T-DNA insertion is located in exon 1, but homozygous alleles could not be obtained. Heterozygous SALK_063500 plants displayed an aberrant siliqua phenotype, attributed to a reduction in pollen tube germination rate. These original data highlight the role of AT1G05290 in pollen development and provide insights into the mechanisms of male sterility in plants.",6
Utilization of singleâ€šÃ„Ãªimage normalized difference vegetation index (SIâ€šÃ„ÃªNDVI) for early plant stress detection,https://www.ncbi.nlm.nih.gov/pmc/articles/PMC6201722/,"utilization, single, image, normalized, difference, vegetation","This paper describes the development and validation of a single-image normalized difference vegetation index (SI-NDVI) imaging system for the early and cost-effective detection of plant stress under controlled conditions, such as indoor agriculture. Unlike traditional NDVI, which uses red light, SI-NDVI compares leaf reflectance in the blue and near-infrared (NIR) light spectra. The system uses a commercial camera modified with a special filter to capture both spectra in a single image, simplifying the process and reducing costs. Images are analyzed with open-source software and spreadsheets to generate qualitative (false-color images) and quantitative (graphs) representations. SI-NDVI was shown to detect stress in *Arabidopsis thaliana* seedlings and *Eruca sativa* plants within 15 minutes of stressor application (salinity, ammonium nitrate), well before it was visible to the naked eye. This technology offers a more accessible, cost-effective, and user-friendly tool than traditional NDVI or hyperspectral methods for monitoring plant health.",7
Comparing RNA-Seq and microarray gene expression data in two zones of the Arabidopsis root apex relevant to spaceflight.,https://www.ncbi.nlm.nih.gov/pmc/articles/PMC6240453/,comparing rna seq and microarray gene expression,"This study examined the feasibility of analyzing transcriptomes from tiny sections of the root tip of *Arabidopsis thaliana*—a crucial region for environmental sensing and of interest in spatial experiments—by comparing RNA sequencing (RNA-Seq) with microarrays. Roots were sectioned into two regions to compare differential gene expression. Both methods were found to be applicable to small samples, identifying 4,180 genes with differential expression between regions. RNA-Seq detected 771 unique genes and 19 novel regions not found by microarrays, but the microarrays identified spaceflight-relevant genes that RNA-Seq missed. The research concludes that root tip subsections can be used for transcriptome analysis with either technique, although RNA-Seq may miss some gene expression changes important for the space environment, suggesting the need to improve the techniques for small and rare samples.",8
Spaceflight-induced alternative splicing during seedling development in Arabidopsis thaliana.,https://www.ncbi.nlm.nih.gov/pmc/articles/PMC6447593/,"spaceflight induced, alternative, splicing, during, seedling, development","This study investigates the role of alternative splicing (AS) in the molecular adaptation of plants to the spaceflight environment. By analyzing RNA-seq data from *Arabidopsis thaliana* seedlings grown on the International Space Station and ground-based controls, significant differences in AS were detected between the two conditions. This research provides the first evidence that AS plays a role in the molecular processes of physiological adaptation to the space environment in higher eukaryotic organisms and is the first observation of spaceflight-induced AS at the transcriptome-wide level in any organism.",8
The Plant Health Monitoring System of the EDEN ISS Space Greenhouse in Antarctica during the 2018 experiment phase,https://www.ncbi.nlm.nih.gov/pmc/articles/PMC7264257/,"plant, health, monitoring, system, eden, iss","The EDEN ISS is a space-analog greenhouse located in Antarctica, designed to research plant breeding for future human space exploration missions. During its 2018 operating season, 26 different types of crops were grown on a 12.5 m² cultivation area, producing over 268 kg of edible biomass, with cucumbers, lettuce, leafy greens, and tomatoes as the main crops. The facility features advanced subsystems for environmental and nutrient control, and its unique location in Antarctica makes it a valuable testbed for space cultivation technologies and procedures. The detailed biomass production data generated by this project are critical for improving space greenhouse models and crop selection that will help reduce resupply mass on future space missions.",10
Root skewing-associated genes impact the spaceflight response of Arabidopsis thaliana.,https://www.ncbi.nlm.nih.gov/pmc/articles/PMC7064724/,"root, skewing associated, genes, impact, spaceflight, response","The APEX-03-2 study investigated the contribution of the SPIRAL1 (SPR1) and SKU5 genes to root behavior and gene expression in Arabidopsis under microgravity. Although previously thought to be gravity-dependent, root skewing occurs in space, suggesting that root morphology and cell wall remodeling are key to physiological adaptation. SPR1 is involved in directional cell expansion and microtubule dynamics, while SKU5 is a protein anchored to the plasma membrane and cell wall, linked to signaling stress responses. *spr1* and *sku5* mutants exhibited markedly different twisting behaviors and gene expression patterns in space. *spr1* mutants showed fewer differentially expressed genes than the wild type, suggesting that the loss of SPR1 positively impacts adaptation to spaceflight. In contrast, *sku5* mutants had significantly more differentially expressed genes, indicating a more complex stress response and the importance of SKU5 function for proper adaptation. Developmental age also had a significant influence, especially in *sku5* plants. These findings demonstrate that the torsional pathways represented by SKU5 and SPR1 make unique and opposing contributions to spatial physiological adaptation.",8
Articular cartilage and sternal fibrocartilage respond differently to extended microgravity.,https://www.ncbi.nlm.nih.gov/pmc/articles/PMC6379395/,Articular cartilage and sternal fibrocartilage respond,"study investigated the effects of 30 days of microgravity in mice, observing pathological changes in articular cartilage (AC) and sternal cartilage (SC). The AC of in-flight mice showed evidence of degradation, with loss of proteoglycans and reduced matrix protein expression, in addition to surface damage and osteophyte formation. In contrast, the SC showed no signs of deterioration or changes in gene expression suggestive of degradation. The findings indicate that the AC, a weight-bearing tissue, is negatively affected by microgravity unloading, while the SC, which receives a constant minimal load (from breathing), is not. This suggests that the response of cartilage tissue to microgravity depends on the biomechanical environment to which it is normally adapted, and it is proposed that maintaining physiological loading on the AC during spaceflight could minimize its damage.",8
Host-microbe interactions in microgravity: assessment and implications.,https://www.ncbi.nlm.nih.gov/pmc/articles/PMC4187166/,"host microbe, interactions, microgravity, assessment, and, implications","Spaceflight imposes unique stresses such as microgravity, which alters host-microbiome interactions crucial to health. Microgravity affects the physiology and genetics of plants and animals, causing effects ranging from bone loss in humans to increased susceptibility to pathogens. Although general effects have been observed in hosts, the impact on their microbiomes is still under investigation. Microgravity has been shown to increase the virulence and resistance of some pathogens such as Salmonella by altering their gene expression, although decreased virulence has been observed in other cases. Research into these phenomena is conducted both in realistic microgravity environments and in Earth-based simulations, such as rotating-wall bioreactors. Understanding microbial adaptation and maintaining homeostasis between humans, plants, and their microbiomes is essential for future long-duration space travel.",7
Environmental cues and symbiont microbe-associated molecular patterns function in concert to drive the daily remodeling of the crypt-cell brush border of the Euprymna scolopes light organ,https://www.ncbi.nlm.nih.gov/pmc/articles/PMC5219934/,environmental cues and symbiont microbe associated molecular,"The text describes how the microbiota influences the brush border microarchitecture of host epithelial tissues, using the squid-Vibrio symbiotic system. A daily effacement of microvilli is observed at dawn, coinciding with the expulsion of symbionts, and a subsequent repolarization with an increase in microvilli density. The investigation reveals that effacement is triggered by an environmental light signal and occurs independently of the presence of symbionts. Furthermore, the increase in microvillar density and repolarization after dawn require the presence of symbionts and are specifically induced by host exposure to phosphorylated lipid A from symbiont cells. These findings demonstrate that the brush border is shaped by a combination of environmental and microbial cues, with microbe-associated molecular patterns playing a crucial role in regulating its microarchitecture.",8
Symbiotic organs shaped by distinct modes of genome evolution in cephalopods.,https://www.ncbi.nlm.nih.gov/pmc/articles/PMC6386654/,"symbiotic, organs, shaped, distinct, modes, genome","Analysis of the genome of the Hawaiian squid *Euprymna scolopes* reveals extensive genomic reorganization in cephalopods and provides new insights into the evolution of specialized symbiotic organs. The two symbiotic organs of *E. scolopes*, the light organ (LO) and the accessory nidamental gland (ANG), were found to have arisen through distinct evolutionary mechanisms; the LO evolved by subfunctionalization of ocular genes, whereas the ANG was enriched with species-specific orphan genes. Genes associated with these symbiotic organs showed signs of recent duplications, unlike the older genes related to the brain and eyes.",6
Modeled microgravity alters lipopolysaccharide and outer membrane vesicle production of the beneficial symbiont Vibrio fischeri,https://www.ncbi.nlm.nih.gov/pmc/articles/PMC7940393/,Modeled microgravity alters lipopolysaccharide and outer,"This study examines the impact of simulated microgravity on the symbiotic bacterium *Vibrio fischeri*, demonstrating a significant increase in lipopolysaccharide (LPS) release and outer membrane vesicle (OMV) production. Although bacterial motility is not directly altered, simulated microgravity increases LPS release even in motility-deficient mutants. Furthermore, *V. fischeri* cells exposed to these conditions show increased susceptibility to membrane-disrupting agents, suggesting changes in membrane integrity. These results indicate that the physiology of symbiotic microbes can be altered under microgravity conditions, which could have important implications for host health during spaceflight.",9
Emergence of novel cephalopod gene regulation and expression through large-scale genome reorganization,https://www.ncbi.nlm.nih.gov/pmc/articles/PMC9023564/,"emergence, novel, cephalopod, gene, regulation, and","This study explores the genomic basis of the complex behaviors and large nervous systems of coleoid cephalopods (squid, cuttlefish, octopus) using the squid *Euprymna scolopes*. The research reveals extensive genomic restructuring in these animals, resulting in the emergence of hundreds of clusters of unique, tightly linked genes, termed microsyntenies. These novel microsyntenies form topological compartments with distinct regulatory structures and contribute to complex expression patterns. Microsyntenies associated with cephalopodal innovations (MACIs) enriched in nervous system expression were identified, suggesting that they were fundamental to their evolution. The study also noted larger and more variable topologically associated domains (TADs) in squid compared to humans, and proposes that microsynthetic profiling is key to understanding cephalopod innovations.",8
Modeled microgravity alters apoptotic gene expression and caspase activity in the squid-vibrio symbiosis,https://www.ncbi.nlm.nih.gov/pmc/articles/PMC9389742/,modeled microgravity alters apoptotic gene expression,"This study investigated the impact of simulated microgravity on beneficial microbe-induced apoptosis using the symbiosis between the bobtail squid (*Euprymna scolopes*) and the bacterium *Vibrio fischeri*. Host genome and transcriptome analysis revealed that microgravity altered the expression of extrinsic and intrinsic apoptosis genes, leading to earlier and higher activation, particularly of caspases, whose activity was shown to be increased. These effects could be mitigated by caspase inhibitors, suggesting that perturbations in apoptosis signaling can be controlled, with implications for maintaining animal-microbial homeostasis during spaceflight.",8
In vitro generation of mechanically functional cartilage grafts based on adult human stem cells and 3D-woven poly(epsilon-caprolactone) scaffolds,https://www.ncbi.nlm.nih.gov/pmc/articles/PMC2824534/,"vitro, generation, mechanically, functional, cartilage, grafts","This study explored functional cartilage tissue engineering in vitro using human mesenchymal stem cells (hMSCs) combined with three-dimensionally woven poly(Îµ-caprolactone) (PCL) scaffolds. The objectives included achieving cartilage-like mechanical properties, demonstrating cartilage formation by hMSCs on the scaffolds, and analyzing the impact of scaffold structure (loosely woven vs. tightly woven), culture vessel (static vs. rocking bioreactor), and medium composition. The results showed that constructs with tightly woven PCL scaffolds cultured in bioreactors achieved aggregate modules close to normal articular cartilage. The bioreactors produced constructs with higher collagen content and a more homogeneous matrix, while chondrogenic additives increased glycosaminoglycans (GAGs) and early collagen II messenger RNA expression, especially without serum. Chondrogenesis was verified histologically by rounded cells within a hyaline matrix that immunostained for type II but not type I collagen. These findings demonstrate the feasibility of engineering functional cartilage tissue from hMSCs and 3D woven PCL scaffolds.",10
Chondrogenesis and mineralization during in vitro culture of human mesenchymal stem cells on three-dimensional woven scaffolds,https://www.ncbi.nlm.nih.gov/pmc/articles/PMC2991213/,Chondrogenesis and mineralization during vitro culture,"This study investigates the use of human mesenchymal stem cells (hMSCs) on three-dimensional (3D) polycaprolactone (PCL) scaffolds for skeletal tissue engineering, evaluating how culture duration and medium additives influence the structure, composition, mechanical, and molecular properties of the generated tissues. Bone marrow hMSCs were seeded on PCL scaffolds and cultured for 1, 21, or 45 days, under chondrogenic or osteogenic conditions. In chondrogenic medium, cartilage tissue was formed by day 21, with hypertrophic mineralization observed at the interface with the scaffold by day 45. Glycosaminoglycan, hydroxyproline, and calcium contents, as well as alkaline phosphatase activity, depended on culture duration and additives, showing significant interactive effects. The 45-day-old constructs exhibited mechanical properties similar to native articular cartilage and gene expression characteristic of chondrogenesis and endochondral bone formation. In contrast, the osteogenic medium produced limited osteogenesis. These findings suggest that long-term culture of hMSCs on 3D scaffolds under chondrogenic conditions results in chondrogenesis and regional mineralization, which is relevant for graft development in the repair of osteochondral defects.",10
Microbiome metadata standards: Report of the National Microbiome Data Collaborative's workshop and follow-on activities.,https://www.ncbi.nlm.nih.gov/pmc/articles/PMC8269219/,"microbiome, metadata, standards, report, national, data","This text is a correction to a scientific article entitled ""Microbiome metadata standards: report of the National Microbiome Data Collaborative's workshop and follow-on activities"" by Vangay et al., published in the journal mSystems. The correction specifies how the article's authorship and affiliation should be read. This is an open access article under a Creative Commons license, provided by the American Society for Microbiology (ASM) and hosted on an official U.S. government website.",8
Spaceflight alters host-gut microbiota interactions,https://www.ncbi.nlm.nih.gov/pmc/articles/PMC11362537/,"spaceflight, alters, host gut, microbiota, interactions","This study investigates the impact of spaceflight on mammals, focusing on interactions between the gut microbiome and the host. Using a multi-omics approach in mice, the gut microbiota and gene expression in the colon and liver were analyzed after 29 and 56 days in space. The study revealed significant changes in 44 microbial species, such as a reduction in bile acid and butyrate-metabolizing bacteria (*Extibacter muris*, *Dysosmobacter welbionis*), and an overrepresentation of genes related to fatty acid and bile metabolism, extracellular matrix interactions, and antibiotic resistance. At the host level, corresponding alterations in bile acid and energy metabolism, as well as immune suppression, were observed. These results imply that interactions at the gut-microbiome interface contribute to spaceflight-associated pathologies and are crucial for human health and the viability of long-duration space missions.",7
Asparagine biosynthesis as a mechanism of increased host lethality induced by Serratia marcescens in simulated microgravity environments,https://www.ncbi.nlm.nih.gov/pmc/articles/PMC9111996/,asparagine biosynthesis mechanism increased host lethality,"This study investigates how simulated microgravity (LSMMG) increases the virulence of the opportunistic bacterium *Serratia marcescens*, a pathogen relevant to astronaut health. The findings show that LSMMG increases asparagine uptake and synthesis in *S. marcescens*, leading to a significant increase in host (*Drosophila melanogaster*) mortality. This effect is reproduced by adding aspartate and glutamine, precursors of asparagine, and is associated with overexpression of the *asnB* gene (asparagine synthase B) in the bacterium. Although accelerated bacterial growth contributes, the combination of aspartate and glutamine is required for maximum lethality and overexpression of key genes in the asparagine pathway. Furthermore, L-asparaginase, which breaks down asparagine, was identified as able to mitigate LSMMG-induced virulence, offering a potential countermeasure strategy. The research highlights the importance of the asparagine utilization pathway for understanding the molecular mechanisms of virulence in microgravity and developing solutions.",9
Comparative genomic analysis of Cohnella hashimotonis sp. nov. isolated from the International Space Station.,https://www.ncbi.nlm.nih.gov/pmc/articles/PMC10308117/,comparative genomic cohnella hashimotonis nov isolated,"A new bacterial strain, F6_2S_P_1T, was isolated in April 2018 from the wall behind the Waste Hygiene Compartment aboard the International Space Station (ISS). Through genomic analysis, it was identified as a novel species within the genus Cohnella, and the name *Cohnella hashimotonis* was proposed. This discovery, part of the Microbial Tracking mission, highlights the importance of studying the ISS microbiome for astronaut health and the development of biotechnological applications in future space habitats. Complete genome sequences of related Cohnella type strains have also been generated for characterization.",9
Characterization of metagenome-assembled genomes from the International Space Station,https://www.ncbi.nlm.nih.gov/pmc/articles/PMC10233975/,"characterization, metagenome assembled, genomes, from, international, space","This study generated and analyzed 46 metagenome-assembled genomes (MAGs) from 21 environmental samples from the International Space Station (ISS) to investigate microbial diversity and its evolution under spaceflight conditions. Eighteen bacterial species were identified, including one new genus/species and one new bacterial species, and fungal genomes were assembled from ISS metagenomes for the first time. The analyses revealed ISS-specific evolution in some bacterial species, enrichment of cell membrane genes, and the characterization of antimicrobial resistance and virulence genes, which are more prevalent in certain strains. Genetic variations observed in strains such as Pantoea/Kalamiella suggest their susceptibility to microgravity. These reconstructed genomes will facilitate future studies of microbial evolution in space.",8
Biocontrol in built environments to reduce pathogen exposure and infection risk.,https://www.ncbi.nlm.nih.gov/pmc/articles/PMC10848226/,"biocontrol, built, environments, reduce, pathogen, exposure","The built environment harbors diverse microbial communities, including antibiotic-resistant pathogens that pose infection risks. Despite a long history of disinfection methods, from ancient to modern practices, antimicrobial resistance has increased, rendering traditional cleaning solutions increasingly ineffective. A promising new strategy is microbial biocontrol, which involves the introduction of beneficial microbes, such as Bacillus spores, to inhibit pathogen survival and transmission. However, the exact mechanisms of this action are not fully understood. Continued research using advanced methods such as high-throughput sequencing and metabolomics, along with experimental studies and targeted interventions, is required to better understand the microbial ecology of built environments and develop effective and validated biocontrol solutions, especially in clinical settings where drug-resistant pathogens are a growing global health concern.",7
Extracellular nucleotides elicit cytosolic free calcium oscillations in Arabidopsis.,https://www.ncbi.nlm.nih.gov/pmc/articles/PMC3329368/,"extracellular, nucleotides, elicit, cytosolic, free, calcium","Extracellular purine nucleotides (ATP and ADP) regulate plant development, defense, and stress responses by activating plasma membrane calcium channels. This research reveals that, in addition to factors known as wounding or osmotic stress, abscisic acid (ABA) and L-glutamate also cause ATP accumulation around the roots of *Arabidopsis thaliana*. The release of ADP from the root epidermis triggers an ionotropic receptor-like activity, causing a transient increase in free cytosolic calcium that, unlike that induced by ATP, does not involve extracellular reactive oxygen species, as confirmed experimentally. The perception of these nucleotides also influences the net fluxes of Ca2+ and K+ in root cells.",7
