Title,Link,Keywords,Resumen,Importancia
Dietary countermeasure mitigates simulated spaceflight-induced osteopenia in mice,https://www.ncbi.nlm.nih.gov/pmc/articles/PMC7162976/,"dietary, countermeasure, mitigates, simulated, spaceflight induced, osteopenia","A study investigated whether dietary supplementation with prune powder (DP) can prevent bone loss in mice exposed to simulated spaceflight conditions (microgravity and radiation). The results showed that a DP diet was effective in preventing most of the deterioration in bone microarchitectural and mechanical properties caused by simulated microgravity and the combination of microgravity and radiation. Furthermore, the DP diet protected osteoprogenitors from deterioration. These findings suggest that DP could be an effective countermeasure against skeletal deficits in astronauts during spaceflight.",8
Simulated microgravity alters gene regulation linked to immunity and cardiovascular disease,https://www.ncbi.nlm.nih.gov/pmc/articles/PMC11353732/,"simulated, microgravity, alters, gene, regulation, linked","This study investigated cardiac responses to prolonged exposure to simulated microgravity using a hindlimb unloading (HU) model in rats of different ages and sexes, with the goal of understanding oxidative damage and gene expression. The results showed sex-dependent changes in the oxidative damage marker 8-OHdG and antioxidant gene expression in left ventricular tissue. Young females (3 months old) exhibited elevated 8-OHdG levels after 14 days of HU, unlike age-matched males. RNAseq analysis in nine-month-old males revealed upregulation of proinflammatory signaling pathways and immune cell activation, as well as differential expression of genes associated with cardiovascular disease progression. These findings suggest the need to consider sex differences and target antioxidant and immune pathways when developing countermeasures to maintain cardiovascular health during space missions.",8
Autophagy and its consequences for platelet biology,https://www.ncbi.nlm.nih.gov/pmc/articles/PMC11953390/,Autophagy and its consequences for platelet,"This study identified novel drug targets for chronic kidney disease (CKD), a progressive condition with limited treatments. Using Mendelian randomization (MR) analysis, druggable genes were investigated from cis-eQTL data and genome-wide association studies (GWAS) of CKD from the eQTLGen and FinnGen databases, respectively. Gene Ontology (GO) and KEGG enrichment analyses, along with colocalization analysis, revealed 12 genes to be significantly associated with CKD risk. Among them, the TUBB gene emerged as the most promising drug target, sharing a causal variant with CKD with a high probability, offering valuable insights for future drug development.",6
A new role of NAP1L1 in megakaryocytes and human platelets,https://www.ncbi.nlm.nih.gov/pmc/articles/PMC9737020/,new role nap1l1 megakaryocytes and human,"This study investigated the expression and functionality of the NAP1L1 protein in platelets (PLTs) and megakaryocytes (MKs). NAP1L1 was found to be expressed in both cells, at the mRNA and protein levels, and localized to the cytoplasm of MKs and perigranularly in PLTs, suggesting non-nuclear functions. The investigation revealed that NAP1L1 dynamically interacts with PDC-E2, a subunit of the mitochondrial pyruvate dehydrogenase (PDH) complex, crucial for cellular respiration. Increased NAP1L1 expression and PDH activity were observed in platelets from septic patients. However, overexpression of NAP1L1 in MKs significantly decreased proplatelet formation (thrombopoiesis) and PDH activity in a simulated septic environment. These findings suggest that NAP1L1 plays roles other than nucleosome assembly, acting as a potential chaperone or regulator of the mitochondrial protein PDC-E2, and influencing PDH activity and platelet production.",7
Evaluation of rodent spaceflight in the NASA animal enclosure module for an extended operational period (up to 35 days),https://www.ncbi.nlm.nih.gov/pmc/articles/PMC5515519/,"evaluation, rodent, spaceflight, nasa, animal, enclosure","This study evaluated the ability of NASA's Animal Enclosure Module (AEM), designed for short-haul flights, to support rodents on missions of up to 35 days on the International Space Station. Researchers tested the hardware with 12 C57BL/6 mice and 5 Sprague-Dawley rats, monitoring their health, growth, intake, and environmental parameters. The AEM was shown to support the mice for 35 days with self-contained food and water, and the rats for the same period with external resupply of diet and water, maintaining their well-being and health parameters comparable to vivarium controls. The study concludes that the AEM is flexible and capable of operating for up to 35 days with minor modifications, making it suitable for longer-term space science research with rodents, although additional studies are needed for durations longer than 35 days.",10
Morphology of Penicillium rubens Biofilms Formed in Space,https://www.ncbi.nlm.nih.gov/pmc/articles/PMC10144393/,"morphology, penicillium, rubens, biofilms, formed, space","This study examined the impact of microgravity on the formation of *Penicillium rubens* fungal biofilms on seven materials relevant to spacecraft and hospital environments, a critical concern for spaceflight due to potential damage to spacecraft and health risks to astronauts. Spore-inoculated materials were flown to the International Space Station (ISS) for development for 10, 15, and 20 days, compared to ground-based controls. Although microgravity did not significantly alter the overall morphology, biomass, or surface coverage of biofilms, it did influence their formation, increasing or decreasing the amount of biofilm in some cases, in a time- and material-dependent manner. The Nanograss material showed a significant reduction in biofilm formation both in microgravity and on Earth, making it a potential solution. These findings are essential for understanding and mitigating fungal contamination on space missions.",7
Explainable machine learning identifies multi-omics signatures of muscle response to spaceflight in mice,https://www.ncbi.nlm.nih.gov/pmc/articles/PMC10719374/,"explainable, machine, learning, identifies, multi omics, signatures","This study uses multi-omic and physiological data from mice exposed to microgravity to identify molecular biomarkers associated with muscle atrophy during spaceflight. Using the symbolic regression algorithm QLattice, data from the soleus and tibialis anterior muscles were analyzed to predict calcium reuptake levels. The results indicate that Acyp1 and Rps7 proteins are the most predictive biomarkers for tibialis anterior muscle resilience in space, with Acyp1 negatively correlated with calcium reuptake. These findings offer potential targets for future interventions aimed at reducing muscle atrophy during spaceflight.",9
Microbial adaptation to spaceflight is correlated with bacteriophage-encoded functions,https://www.ncbi.nlm.nih.gov/pmc/articles/PMC11096397/,Microbial adaptation spaceflight correlated with bacteriophage encoded,"The article investigates microbial adaptation on the International Space Station (ISS), highlighting the role of latent bacteriophages (prophages) as mediators of such adaptation. An analysis of 245 bacterial genomes isolated from the ISS revealed that phage-associated genes are significantly different between space-borne and ground-based strains. A total of 283 complete prophages were identified, 21% of which are novel, and encode functions that correlate with increased persistence in extreme environments, such as antimicrobial resistance, virulence, DNA repair, and dormancy. These findings suggest that microbial adaptation in space is linked to bacteriophage-encoded functions, which could have implications for human health during extended space missions.",8
Influence of the spaceflight environment on macrophage lineages,https://www.ncbi.nlm.nih.gov/pmc/articles/PMC11166655/,"influence, spaceflight, environment, macrophage, lineages","This article reviews the impact of space and its unique risk factors, such as radiation and altered gravity, on the immune system, with a focus on macrophages. Macrophages are immune cells crucial for innate and adaptive immunity, homeostasis, defense against infection, and wound healing. Research indicates that spaceflight can alter leukocyte count and function, causing chronic low-grade inflammation. Changes in monocyte count, phagocytic activity, cytokine production, and macrophage differentiation/polarization have been observed in both humans and rodents, although with some differences between species. Furthermore, spaceflight affects specialized macrophages such as osteoclasts, contributing to bone loss, and microglia, which could induce neuroinflammation. A thorough understanding of these responses is critical for astronaut health and for developing countermeasures for future missions, although further in-flight research is required to fully characterize their altered phenotypes and functions.",7
MARSBOx: Fungal and bacterial resistance from a balloon-flown analog mission in the stratosphere,https://www.ncbi.nlm.nih.gov/pmc/articles/PMC7937622/,Marsbox fungal and bacterial endurance from,"study investigated the ability of terrestrial life to withstand the Martian environment via a NASA science balloon mission to the mid-stratosphere (âˆ¼38 km altitude) in September 2019. This altitude simulates the radiation, dehydration, hypoxia, and low temperature and pressure conditions of the equatorial surface of Mars. Samples of fungal spores (Aspergillus niger) and bacterial cells (Salinisphaera shabanensis, Staphylococcus capitis subsp. capitis, and Buttiauxella sp. MASE-IM-9) were exposed in the MARSBOx module, some to full UV-VIS radiation and others shielded. After five hours, A. niger spores and S. shabanensis cells showed the greatest resistance, while Buttiauxella sp. was completely inactivated and S. capitis only survived when protected from UV radiation. The results highlight a wide variation in microbial survival and suggest that pigmented fungi could be resistant to the Martian surface if inadvertently transported by spacecraft, which is relevant for planetary protection.",9
In situ linkage of fungal and bacterial proliferation to microbiologically influenced corrosion in B20 biodiesel storage tanks.,https://www.ncbi.nlm.nih.gov/pmc/articles/PMC7055474/,"situ linkage, fungal and bacterial proliferation","Biodiesel (B20) is a promising renewable fuel, but it is susceptible to biodegradation and microbial corrosion, an understudied problem *in situ*. This study, the first of its scale, conducted a year-long investigation in operational U.S. Air Force B20 tanks to assess microbial proliferation, fuel degradation, and microbiologically influenced corrosion. Diverse and unique bacterial populations were identified for each location, while eukaryotic populations, such as the filamentous fungi Trichocomaceae and the yeasts Saccharomycetaceae, were consistent across sites. A key finding was the correlation between increased Trichocomaceae abundance and visible fouling and pitting corrosion. The study was able to establish a relationship between B20 fouling, increased corrosion, and the responsible microorganisms, primarily at the bottom of the tanks.",8
"Identification of metagenome-assembled genomes containing antimicrobial resistance genes, isolated from an advanced water treatment facility.",https://www.ncbi.nlm.nih.gov/pmc/articles/PMC7118179/,"identification, metagenome assembled, genomes, containing, antimicrobial, resistance","This study identified 95 metagenome-assembled genomes (MAGs) containing 185 antimicrobial resistance genes (ARGs) in samples from an Orange County Water District (OCWD) advanced wastewater treatment plant, taken before microfiltration. MAGs were not found after barrier filtration, suggesting the effectiveness of the treatment. The research, which uses DNA sequencing and bioinformatics tools, expands knowledge about microbial lineages harboring ARGs in ultrapure water facilities and offers a useful resource for the water treatment community.",7
Nature of pre-earthquake phenomena and their effects on living organisms,https://www.ncbi.nlm.nih.gov/pmc/articles/PMC4494396/,"nature, pre earthquake, phenomena, and, their, living","The text addresses the difficulty of predicting earthquakes, highlighting that although traditional seismology is based on past data, numerous non-seismic signals exist prior to the events. It criticizes mechanistic explanations such as microfracturing and the electrokinetic effect for being inconsistent with depth conditions. Instead, it proposes a theory involving the activation of ""positive holes"" (hâ€¢), electronic charge carriers formed in silicate minerals under stress. These positive holes are highly mobile, generating ultra-low frequency (ULF/ELF) electromagnetic waves that can reach the surface. Upon arrival, they ionize the air and oxidize the water, which could explain the unusual animal behavior and other physical and chemical anomalies observed before earthquakes.",6
The rapid diagnosis and effective inhibition of coronavirus using spike antibody attached gold nanoparticles,https://www.ncbi.nlm.nih.gov/pmc/articles/PMC8323809/,Rapid diagnosis and effective inhibition of coronavirus,"Gold nanoparticles functionalized with anti-spike antibodies have been developed for the rapid diagnosis of COVID-19 and the inhibition of SARS-CoV-2. This system detects the virus or its antigen within 5 minutes through a colorimetric change from pink to blue, observable with the naked eye. It also employs surface-enhanced Raman spectroscopy (SERS) for ultrasensitive detection within the same timeframe, identifying the antigen at concentrations of picograms per milliliter and the virus at very low particles per milliliter. Beyond diagnosis, these nanoparticles demonstrate the ability to block SARS-CoV-2 entry into human cells by binding to its spike protein, preventing infection and spread, and can even destroy its lipid membrane.",7
Blocking SARS-CoV-2 Delta variant (B.1.617.2) spike protein receptor-binding domain binding with the ACE2 receptor of the host cell and inhibiting virus infections using human host defense peptide-conjugated graphene quantum dots.,https://www.ncbi.nlm.nih.gov/pmc/articles/PMC8886715/,"blocking, sars cov 2, delta, variant, 617, spike","study reveals that graphene quantum dots (GQDs) conjugated with human defense peptides (HNP1 and LL-37) can block the entry of the SARS-CoV-2 delta variant (B.1.617.2) into host cells. These bioconjugates prevent the binding of the receptor-binding domain (RBD) of the viral S protein to the ACE2 receptor, showing a high binding affinity (9 nM), comparable to that of the ACE2-S protein interaction, and a higher affinity for the delta variant than for other variants. Experimental assays confirm complete inhibition of delta variant pseudovirion entry and low cytotoxicity in cell lines, offering a potential new strategy against infection.",9
Safety and pharmacokinetics of intranasally administered heparin,https://www.ncbi.nlm.nih.gov/pmc/articles/PMC8890767/,Safety and pharmacokinetics intranasally administered heparin,"This study investigated the safety and pharmacokinetics of intranasally administered unfractionated heparin (UFH) as a potential prophylactic agent for COVID-19. Daily intranasal doses of UFH were administered to mice for 14 days, and its safety was tested in a small group of healthy human subjects. The results showed no evidence of toxicity in mice at any of the measured doses, nor significant changes in blood coagulation or minor irritant events. Similarly, human subjects did not present significant changes in coagulation parameters or serious adverse events. Pharmacokinetic analysis in mice revealed a single-phase clearance, with potentially protective levels of UFH remaining in the nasal cavity for up to 12 hours after administration. Overall, UFH demonstrated no toxic effects with prolonged daily intranasal use in both mice and humans.",6
Inhibition of SARS-CoV-2 wild-type (Wuhan-Hu-1) and Delta (B.1.617.2) strains by marine sulfated glycans.,https://www.ncbi.nlm.nih.gov/pmc/articles/PMC9487896/,"inhibition, sars cov 2, wild type, wuhan hu 1, and, delta","The COVID-19 pandemic has prompted the search for anti-SARS-CoV-2 molecules, focusing on the virus's S protein, whose binding to heparan sulfate proteoglycans (HSPGs) and angiotensin-converting enzyme-2 is key to infection. However, rapid mutations in the SARS-CoV-2 S protein, such as those observed in the Delta variant, present a challenge for inhibitor design. Marine sulfated glycans (MSGs) have shown promise by competitively disrupting the interaction between the S protein and HSPGs. This study evaluated seven different MSGs against the wild-type (Wuhan-Hu-1) and Delta (B.1.617.2) SARS-CoV-2 strains. Although all MSGs displayed strong inhibitory activity against both strains (generally similar to or slightly lower than heparin), no correlation was found between their structural characteristics and viral inhibition. Nevertheless, the study shows that MSGs maintain their inhibitory activity against evolving SARS-CoV-2 strains, suggesting their potential as effective prophylactic and therapeutic molecules with low cytotoxicity.",7
Inhibition of Cytomegalovirus by Pentacta pygmaea Fucosylated Chondroitin Sulfate Depends on Its Molecular Weight,https://www.ncbi.nlm.nih.gov/pmc/articles/PMC10142442/,inhibition cytomegalovirus pentacta pygmaea fucosylated chondroitin,"recent study investigated fucosylchondroitin sulfate from the starfish Pentacta pygmaea (PpFucCS) as a potential antiviral agent against human cytomegalovirus (HCMV). HCMV binds to host cells via heparan sulfate (HS) proteoglycans prior to entry, and PpFucCS was shown to potently inhibit this viral entry by blocking interactions between HS and the virus. Antiviral activity was found to be proportional to the chain length of PpFucCS, with its high molecular weight being a key structural element for maximal effect. Furthermore, PpFucCS and its derivatives did not show significant cytotoxicity and protected infected cells. These findings suggest that this novel marine sulfated glycan could be developed as a prophylactic and therapeutic antiviral agent against HCMV infection.",7
Effect of simulated cosmic radiation on cytomegalovirus reactivation and lytic replication,https://www.ncbi.nlm.nih.gov/pmc/articles/PMC11477029/,"simulated, cosmic, radiation, cytomegalovirus, reactivation, and","Space exploration exposes astronauts to galactic cosmic radiation (GCR), which has previously been linked to the reactivation of latent herpesviruses. One study investigated how GCR and other types of radiation affect cytomegalovirus (CMV) reactivation in human cells. It was found that radiation exposure, including simulated GCR, significantly increased viral copy numbers, indicating CMV reactivation. Although no substantial genomic changes were detected, transcriptomic analysis revealed significant upregulation of the UL49 gene, suggesting it as a key factor in the shift from the latent to the lytic phase of the virus. These findings support the hypothesis that GCR is an important contributor to the CMV reactivation observed in the International Space Station crew.",7
Tissue Retrieval and Postharvest Processing Regimen for Rodent Reproductive Tissues Compatible with Long-Term Storage on the International Space Station and Postflight Biospecimen Sharing Program,https://www.ncbi.nlm.nih.gov/pmc/articles/PMC4309301/,tissue retrieval and postharvest processing regimen,"The text details the development of a strategy for collecting and processing animal tissues after spaceflight, with the aim of preserving the effects of flight and minimizing post-flight alterations. The research focused on establishing optimal time windows for post-euthanasia tissue collection, specific to each species and tissue (primarily reproductive), as well as long-term storage methods compatible with the International Space Station (10 months at -80°C) that ensure the recovery of high-quality RNA and proteins. The results indicate that histological integrity is maintained between 1 and 3 hours post-euthanasia, depending on the tissue and species, and RNA quality is preserved for up to 40 minutes in RNAlater. This strategy, which also standardizes post-fixation processing for shipping, is adaptable to biospecimen exchange programs and seeks to maximize the information obtained from animals on space missions given limited study opportunities.",9
Effects of sex and gender on adaptations to space: reproductive health,https://www.ncbi.nlm.nih.gov/pmc/articles/PMC11166981/,"sex, and, gender, adaptations, space, reproductive","The text describes how spaceflight affects insulin and estrogen signaling in mice and humans. In mice, pronounced changes were detected in the liver, resulting in signaling inhibition, insulin resistance, and hepatic steatosis. In humans, alterations in genes and pathways related to insulin and estrogen were observed, associated with insulin resistance, stress response, and viral infections. These findings highlight the need to further investigate the metabolic and endocrinological effects of spaceflight for the success of future interplanetary missions.",7
Effects of spaceflight on the muscles of the murine shoulder.,https://www.ncbi.nlm.nih.gov/pmc/articles/PMC6343501/,"spaceflight, muscles, murine, shoulder","This study investigated the effects of mechanical unloading on the shoulder enthesis, the junction between bone and tendon, in adult mice. The shoulders of mice were paralyzed for 21 days with botulinum toxin A, revealing a significant increase in mechanical failure and hierarchical structural changes. At the millimeter scale, unloading caused bone loss; at the micrometer scale, it decreased the size and alignment of bioapatite crystals; and at the nanometer scale, it induced compositional changes that stiffened the tissue composed of bioapatite and collagen. Mathematical modeling and mechanical testing indicated that these combined factors increased local stress levels and decreased the tissue's ability to absorb energy before failure, thereby increasing the risk of injury. These observations provide new insights into how unloading affects the adult enthesis and its characteristics that confer resistance to failure.",7
Multiscale effects of spaceflight on murine tendon and bone,https://www.ncbi.nlm.nih.gov/pmc/articles/PMC7138367/,multiscale spaceflight murine tendon and bone,"This study investigated the effects of spaceflight on the composition, structure, mechanics, and gene expression of the enthesis (the tendon-bone junction) in mice from the STS-131, STS-135, and Bion-M1 space missions. Nanoscale results showed decreased carbonate levels in bone, possibly due to increased remodeling, and a shift in tendon collagen fibril size toward smaller diameters, which could be due to increased collagen degradation. However, these nanoscale changes did not translate into significant alterations in micro- and milliscale structure and mechanics, as no changes were observed in bone volume, trabecular structure, failure load, or stiffness. This suggests that the tendon enthesis could be robust against the negative tissue effects of spaceflight, perhaps due to its anatomical location in the limbs.",8
Reproducible changes in the gut microbiome suggest a shift in microbial and host metabolism during spaceflight.,https://www.ncbi.nlm.nih.gov/pmc/articles/PMC6689164/,"reproducible, changes, gut, microbiome, suggest, shift","This study examined the effects of spaceflight on the gut microbiota of mice, analyzing fecal samples following a 37-day mission on the International Space Station. The results showed an increase in microbial alpha diversity and an alteration in community structure, changes that were reproducible with data from previous space missions but not with ground-based radiation studies, suggesting the influence of other factors. Significant alterations in the abundance of specific microbial taxa and in microbial energy metabolism capacity were identified. Furthermore, a correlation was found between host liver genes related to protein metabolism and gut microbial genes involved in putrescine degradation. These findings are crucial for understanding the role of gut microbiota in mammalian health in space and developing countermeasures for future space missions.",8
Failure to Generate Bone Marrow Adipocytes Does Not Protect Mice from Ovariectomy-Induced Osteopenia,https://www.ncbi.nlm.nih.gov/pmc/articles/PMC3564669/,"failure, generate, bone, marrow, adipocytes, does","A study investigated whether bone marrow fat contributes to ovariectomy-induced osteopenia (ovx) in mice, comparing wild-type (WT) mice with mice deficient in marrow adipocytes (kitW/Wv). It was found that although ovx increased body fat and bone marrow adiposity in WT mice (whereas kitW/Wv mice lacked marrow adipocytes), the surgery-induced changes in bone mass and formation were statistically indistinguishable between the two genotypes. The findings do not support a causal role for increased bone marrow fat as a mediator of ovariectomy-induced osteopenia in mice.",9
