Title,Link,Keywords,Resumen,Importancia
Routine omics collection is a golden opportunity for European human research in space and analog environments.,https://www.ncbi.nlm.nih.gov/pmc/articles/PMC9583032/,"routine, omics, collection, golden, opportunity, for","The text proposes establishing a routine omics data collection program for European astronauts and spaceflight participants, highlighting that this revolutionary technology in terrestrial medicine has untapped potential to improve occupational health in space. It argues that longitudinal and standardized collection of this data is feasible and represents a ""golden opportunity"" to understand the molecular mechanisms of space-induced physiological changes. This would enable the development of personalized medicine and artificial intelligence-based analyses, improving risk assessment and countermeasures for future missions (including long-duration and those beyond low-Earth orbit). Practical, scientific, ethical, and legal considerations (such as GDPR) are also discussed for creating policies that balance open data for research with subject protection.",9
Spatial omics technologies at multimodal and single cell/subcellular level.,https://www.ncbi.nlm.nih.gov/pmc/articles/PMC9746133/,"spatial, omics, technologies, multimodal, and, single","This text reviews the current and future landscape of spatial omics technologies, which enable a deep understanding of cellular organization and interactions at single-cell and subcellular resolution. The various methodologies, classified into targeted (antibody- or RNA-probe-based) and whole-transcriptome approaches, are explored, highlighting their differences in spatial resolution, multiplexing capacity, and coverage. The review analyzes the capabilities, advantages, and limitations of these techniques, with examples of specific methods and their relevance to research and clinical applications.",6
Genomic characterization and radiation tolerance of Naganishia kalamii sp. nov. and Cystobasidium onofrii sp. nov. from Mars 2020 mission assembly facilities.,https://www.ncbi.nlm.nih.gov/pmc/articles/PMC10422843/,genomic characterization and radiation tolerance naganishia,"This study describes the discovery of two new yeast species, *Naganishia kalamii* sp. nov. and *Cystobasidium onofrii* sp. nov., isolated from NASA cleanrooms during Mars 2020 mission assembly. Their classification was performed using a multiphase taxonomic approach that included morphology, multi-locus sequence analysis, and whole-genome sequencing. Both yeasts showed resistance to UV-C radiation and possess genes associated with tolerance to stresses such as dehydration, desiccation, osmotolerance, and psychrotolerance, underscoring the need to characterize extreme-tolerant microbes to improve NASA's planetary protection techniques and prevent contamination of other celestial bodies.",8
"Genome and clonal hematopoiesis stability contrasts with immune, cfDNA, mitochondrial, and telomere length changes during short duration spaceflight",https://www.ncbi.nlm.nih.gov/pmc/articles/PMC11022651/,Genome and clonal hematopoiesis stability contrasts,"This study investigated the physiological, immunological, and genetic effects of short-duration spaceflight on the crew of the Inspiration 4 (I4) mission, the first all-civilian crew. Using a multi-omics approach and analyzing preflight, intraflight, and postflight blood samples, telomere length, genomic stability, and immune adaptations were examined. Key findings include telomere lengthening during spaceflight, telomere shortening upon return to Earth, and increased immune cell signatures that persisted months after return. No significant genomic instability or clonal hematopoiesis of undetermined potential (CHIP) was observed. This research provides valuable information for future civil and commercial space missions, serving as a benchmark for human adaptation.",10
Inspiration4 data access through the NASA Open Science Data Repository,https://www.ncbi.nlm.nih.gov/pmc/articles/PMC11094041/,"inspiration4, data, access, through, nasa, open","With commercial space travel becoming increasingly accessible, understanding its impact on human health is crucial. NASA's Open Science Data Repository (OSDR) offers transparent and fair access to biological studies, highlighting the SpaceX Inspiration 4 (I4) mission, which collected a wealth of omics and clinical data from civilian astronauts. These data facilitate comprehensive investigations into space-induced biological responses, enabling multimodal and longitudinal assessments. Its open access, coupled with community-driven data standards, leverages artificial intelligence and machine learning to yield valuable insights, guiding future mission planning and health risk mitigation. The article presents a concise guide for accessing and analyzing I4 data at OSDR, setting a precedent for post-mission health monitoring programs. Although much of the information is publicly available, raw data from sensitive human subjects requires an application and ethics approval process for access.",7
Molecular and physiological changes in the SpaceX Inspiration4 civilian crew,https://www.ncbi.nlm.nih.gov/pmc/articles/PMC11357997/,molecular and physiological changes spacex inspiration4,"SpaceX's Inspiration 4 mission, the first with an all-civilian crew in low-Earth orbit, aimed to study physiological, neurovestibular, and neurocognitive changes, as well as the feasibility of biomedical data collection. Findings revealed a variety of physiological and stress responses, neurovestibular changes, and neurocognitive alterations during the 3-day mission. Although molecular changes such as telomere lengthening and increased virus abundance were observed in flight, nearly all parameters returned to pre-flight levels after return to Earth. This suggests that short-duration civilian missions do not pose a significant health risk and offer a valuable opportunity to investigate the early stages of human adaptation to space, laying the groundwork for an expanding biomedical database that can inform the development of countermeasures.",8
Telomeric RNA (TERRA) increases in response to spaceflight and high-altitude climbing,https://www.ncbi.nlm.nih.gov/pmc/articles/PMC11167063/,"telomeric, rna, terra, increases, response, spaceflight","The study investigated telomeric RNA (TERRA) in the radiation-induced DNA damage response (DDR) in astronauts, mountaineers, and cell models. Radiation exposure was found to increase TERRA transcription, which plays a protective role by forming hybrids at telomeric double-strand breaks and facilitating recombination-mediated telomere lengthening. These findings have important implications for scenarios of chronic telomeric DNA damage, such as aging or oxidative stress, and suggest TERRA as a potential therapeutic strategy against ALT-positive tumors.",8
Spatial multi-omics of human skin reveals KRAS and inflammatory responses to spaceflight,https://www.ncbi.nlm.nih.gov/pmc/articles/PMC11166909/,"spatial, multi omics, human, skin, reveals, kras","A pioneering study examined the impact of short-duration spaceflight on human skin, using biopsies and multi-omics analyses from the Inspiration4 crew before and after the mission. The findings revealed significant upregulation of inflammation-associated genes and KRAS signaling across all skin regions. Altered interferon responses, DNA damage, epithelial barrier disruptions, T cell migration, and impaired regeneration, predominantly in external tissue compartments, were also observed. These changes were correlated with alterations in microbial and immune cell activity, providing the first comprehensive insights into astronaut skin for future missions and countermeasures.",9
Longitudinal multi-omics analysis of host microbiome architecture and immune responses during short-term spaceflight,https://www.ncbi.nlm.nih.gov/pmc/articles/PMC11222149/,"longitudinal, multi omics, host, microbiome, architecture, and","six-month longitudinal study of four individuals on the SpaceX Inspiration 4 mission characterized the human microbiome and immune system response to three days in orbit. Using metagenomics, metatranscriptomics, and immune cell profiling on 750 samples from 10 body sites before, during, and after flight, most microbial alterations were found to be transient, such as increased virus shedding on skin during flight. However, longer-term changes in the oral microbiome were detected, including an increase in dental plaque-associated bacteria, correlated with immune cell gene expression. Microbial genes related to phage activity and stress response were also enriched. These detailed findings on changes in astronauts' microbiomes and immune responses during short spaceflights are crucial for future missions, spacecraft design, and space habitat planning.",9
Spatiotemporal expression and control of haemoglobin in space,https://www.ncbi.nlm.nih.gov/pmc/articles/PMC11166948/,spatiotemporal expression and control haemoglobin space,"This study investigates how the space environment affects hemoglobin gene regulation by analyzing multi-omics data from astronauts on NASA, JAXA, and Inspiration4 missions. The results confirm ""space anemia"" by showing significant down-regulation of globin genes during flight, with levels returning to normal after landing, which could be due to a combination of hemolysis and reduced erythroid cell production. Furthermore, the study observed the activation of a switch from adult to fetal globin in space, a phenomenon similar to the one sought to induce hemoglobinopathies on Earth. This work provides valuable insights into the dynamic nature of globin gene regulation in space and its implications for space medicine.",7
"Single-cell multi-ome and immune profiles of the Inspiration4 crew reveal conserved, cell-type, and sex-specific responses to spaceflight",https://www.ncbi.nlm.nih.gov/pmc/articles/PMC11166952/,"single cell, multi ome, and, immune, profiles, inspiration4","This study analyzed astronauts' immune responses to spaceflight using multi-omic and single-cell data from civilian crew members of the SpaceX Inspiration4 (I4) mission. Eighteen cytokines/chemokines related to inflammation, aging, and muscle homeostasis were found to change postflight. A ""spaceflight signature"" in gene expression was identified, enriched in pathways such as oxidative phosphorylation and immune function, the presence of which was confirmed in independent datasets. Key observations included upregulation of FOXP3 in T cells, long-term suppression of MHC class I genes, and the association of infection-related immune pathways with changes in the microbiome. The study reveals conserved and distinct immune disruptions, providing a roadmap for potential countermeasures to preserve astronaut health on future missions.",10
Single-cell analysis identifies preserved features of immune dysfunction in simulated microgravity and spaceflight,https://www.ncbi.nlm.nih.gov/pmc/articles/PMC11166937/,"single cell, identifies, preserved, features, immune, dysfunction","recent study investigated the impact of short-term simulated microgravity on human immune cells using single-cell analysis of PBMCs, validating the findings with data from real space missions. Microgravity was found to significantly alter pathways essential for optimal immunity, such as interferon signaling, the cytoskeleton, and innate inflammation, while also affecting T and NK cell function. The study also identified that microgravity mimics inflammatory aging processes and induces transcription of latent pathogens. Using machine learning, compounds like quercetin were found to be capable of reversing many of these alterations, offering potential countermeasures for maintaining immunity in space.",10
The Space Omics and Medical Atlas (SOMA) and international astronaut biobank,https://www.ncbi.nlm.nih.gov/pmc/articles/PMC11357981/,space omics and medical atlas soma,"The Space Omics and Medical Atlas (SOMA) is an integrated data and sample repository designed to address the biomedical challenges of spaceflight, where aerospace medicine is currently in its infancy. SOMA brings together clinical, cellular, and multi-omics profiles from diverse missions such as the NASA Twin Study and SpaceX Inspiration4, increasing the publicly available human omics data more than tenfold. This resource includes extensive molecular and physiological profiles (genomics, epigenomics, transcriptomics, proteomics, metabolomics, and microbiome), revealing consistent features such as cytokine changes and telomere elongation, even on short, three-day missions. SOMA seeks to Accelerate precision aerospace medicine by providing crucial data for health monitoring, risk mitigation, and countermeasure development for future lunar, Mars, and exploration missions.",8
"Secretome profiling reveals acute changes in oxidative stress, brain homeostasis, and coagulation following short-duration spaceflight",https://www.ncbi.nlm.nih.gov/pmc/articles/PMC11166969/,"secretome, profiling, reveals, acute, changes, oxidative","study profiled the secretomes (plasma proteins, metabolites, and vesicles/extracellular particles) of the SpaceX Inspiration4 crew to analyze the effects of short-duration spaceflight on human physiology. The results showed significant differences in coagulation, oxidative stress, and brain proteins. Although most altered proteins and metabolites in vesicles recovered within six months, a large portion of plasma proteins remained altered postflight, and these alterations were best correlated with peripheral blood mononuclear cells. A complementary study in space mice indicated a potential disruption of the blood-brain barrier. These findings demonstrate that even brief spaceflight impacts human and mouse physiology, providing crucial biomarkers for future countermeasures.",10
Astronaut omics and the impact of space on the human body at scale,https://www.ncbi.nlm.nih.gov/pmc/articles/PMC11166943/,astronaut omics and impact space human,"The text proposes the creation of a ""Human Cell Space Atlas"" and the application of high-resolution omics technologies as open global resources, essential for developing precision space-based healthcare. These advances are crucial for future long-duration planetary missions, which will involve a more diverse space population. The importance of international collaboration to standardize omics data and address the complex ethical, cultural, and legal challenges inherent to human omics in space is emphasized.",9
Transcriptomics analysis reveals molecular alterations underpinning spaceflight dermatology.,https://www.ncbi.nlm.nih.gov/pmc/articles/PMC11166967/,"transcriptomics, reveals, molecular, alterations, underpinning, spaceflight","This study investigates common dermatological problems in astronauts, the underlying biology of which is poorly understood, despite the fact that they pose a significant risk. Using a systems biology approach, transcriptomic data from the skin of space-exposed mice and biochemical and transcriptomic profiles from astronauts were analyzed. The findings suggest that changes in skin health, DNA damage and repair, and mitochondrial dysregulation are potential drivers of these risks, including alterations in skin barrier function and collagen formation. The study also highlights the ability of organisms to readapt to Earth following spaceflight, and its results may guide the development of countermeasures.",9
"Cosmic kidney disease: an integrated pan-omic, physiological and morphological study into spaceflight-induced renal dysfunction",https://www.ncbi.nlm.nih.gov/pmc/articles/PMC11167060/,"cosmic, kidney, disease, integrated, pan omic, physiological","The paper describes research on the effects of spaceflight on kidney health, particularly during long-duration deep-space missions. Using biomolecular, chemical, and morphological analyses of samples from mice exposed to spaceflight and simulated cosmic radiation, as well as from humans, it was found that spaceflight induces dephosphorylation of renal transporters, which could increase the risk of kidney stones, and causes nephron remodeling with distal convoluted tubule expansion and loss of tubule density. Furthermore, simulated cosmic radiation, equivalent to a mission to Mars, caused kidney damage and dysfunction. These findings suggest that spaceflight directly contributes to kidney stone formation and that space radiation can cause significant kidney damage.",9
Spaceflight induces changes in gene expression profiles linked to insulin and estrogen,https://www.ncbi.nlm.nih.gov/pmc/articles/PMC11166981/,"spaceflight, induces, changes, gene, expression, profiles","This study investigated the effects of spaceflight on insulin and estrogen signaling in mice and humans. Significant changes were observed in both groups, particularly in the mouse liver, where inhibition of insulin and estrogen signaling, hepatic insulin resistance, and steatosis were found. In humans, spaceflight induced alterations in genes and pathways related to insulin and estrogen, insulin resistance, stress response, and viral infection. These findings highlight the need for further research into the metabolic and reproductive endocrinological impacts of spaceflight for the future of the species.",8
Protective alleles and precision healthcare in crewed spaceflight,https://www.ncbi.nlm.nih.gov/pmc/articles/PMC11263583/,Protective alleles and precision healthcare crewed,"The text addresses the growing need to understand and protect human health during deep and long-duration space missions, given the greater diversity of the astronaut population. It emphasizes that health risks in space, such as radiation exposure and bone demineralization, require more personalized and effective countermeasures. To this end, the paper proposes the use of ""omics"" technologies to identify protective alleles and develop individualized nutrition, exercise, and treatment recommendations, benefiting both space explorers and people in challenging terrestrial environments, although technical and ethical challenges remain.",7
To boldly go where no microRNAs have gone before: Spaceflight impact on risk for small-for-gestational-age infants,https://www.ncbi.nlm.nih.gov/pmc/articles/PMC11484870/,"boldly, where, micrornas, have, gone, before","The text describes an official U.S. government website (.gov, secured with HTTPS) and the details of a scientific article. This article, published in Communications Biology (October 5, 2024) and covering topics in systems biology, systems analysis, and reproductive disorders, has been corrected to include an omitted acknowledgment to the U.S. Army Medical Research Command for support of LIG. It is licensed under a Creative Commons Attribution-NonCommercial-NoDerivatives 4.0 International License, which permits noncommercial use, dissemination, and reproduction with proper attribution, but not adaptation of the material. Content is provided by Nature Publishing Group through the National Library of Medicine.",8
Growth chambers on the International Space Station for large plants,https://www.ncbi.nlm.nih.gov/pmc/articles/PMC10780891/,"growth, chambers, international, space, station, for","study compared wheat grains grown on the International Space Station (ISS) with a ground-based control group to assess the impact of microgravity on their characteristics. The ISS grains were found to be significantly smaller in weight, area, length, and width, although the differences in perimeter, depth, and roundness were not statistically significant. Contrary to hypothesis, no significant increase in fluctuating skewness was found in the space grains; both groups showed low to very low skewness. Differences in starch composition were identified, with larger type A granules in the ISS grains, but a higher ratio of type B to type A starch in the terrestrial grains, suggesting better baking qualities in the latter. Furthermore, the aleurone layer was inferior in the ISS grains. The study also proposed a new, non-traumatic method for assessing grain asymmetry, with potential for future computerized scanning developments.",7
Microbiological and nutritional analysis of lettuce crops grown on the International Space Station,https://www.ncbi.nlm.nih.gov/pmc/articles/PMC7067979/,"microbiological, and, nutritional, lettuce, crops, grown","This study evaluates the microbiological safety and nutritional quality of red romaine lettuce grown in the Veggie Modules of the International Space Station (ISS) to supplement astronaut diets, comparing it with plants grown on Earth under similar environmental conditions. Microbiological analyses of leaves and roots (bacterial and fungal counts, isolate identification, and community characterization by sequencing) and nutritional analyses (elemental composition, phenolic levels, anthocyanins, and antioxidant capacity) were performed. Although some differences in total bacterial and yeast/mold counts and microbial diversity were observed between tissues and specific experiments, no human pathogens were found. There were also differences in the content of some elements (Fe, K, Na, P, S, Zn) and in the levels of total phenolics between the flight and ground plants. The study concludes that leafy green vegetables can produce fresh, safe, and edible foods for astronauts' diets, providing reference data for the continued operation of veggie cultivation systems on the ISS.",8
Natural variation in the expression of ORGANIC CATION TRANSPORTER 1 affects root length responses to cadaverine in Arabidopsis.,https://www.ncbi.nlm.nih.gov/pmc/articles/PMC4321547/,"natural, variation, expression, organic, cation, transporter","The study investigates how cadaverine, a polyamine, affects plant development, focusing on root length sensitivity in *Arabidopsis thaliana*. It shows that natural variation in ORGANIC CATION TRANSPORTER 1 (OCT1) influences this response. Resistant *Arabidopsis* accessions, such as those from the Cape Verde Islands (Cvi), showed increased OCT1 expression compared to sensitive ones, such as Landsberg erecta (Ler). Furthermore, *oct1* mutants were more sensitive to cadaverine, and the level of OCT1 expression, rather than its specific accession origin, correlated with the response to cadaverine. These findings suggest that reduced OCT1 expression contributes to cadaverine sensitivity in certain accessions.",7
Auxin: Shape matters.,https://www.ncbi.nlm.nih.gov/pmc/articles/PMC6710492/,"auxin, shape, matters","This study evaluated the effect of AsiMax 50®, a commercial formulation of the herbicide 2,4-D, on the structure of freshwater microbial communities, including micro + nano phytoplankton, photosynthetic picoplankton, and bacterioplankton. Using microcosms, two microbial assemblages, from clear and turbid water systems, were exposed to seven concentrations of the herbicide for seven days. Results indicated a greater impact in the turbid system, where the total abundance of live micro + nano phytoplankton increased significantly at low concentrations, while in both systems, species richness and abundance decreased at higher concentrations. This suggests that 2,4-D may mimic a hormonal function. The study concludes that using community-scale approaches in ecotoxicology is crucial for predicting changes in freshwater ecosystems, although caution is warranted when extrapolating laboratory results to real-life scenarios.",6
Gravity signaling in flowering plant roots,https://www.ncbi.nlm.nih.gov/pmc/articles/PMC12008199/,"gravity, signaling, flowering, plant, roots","This study identifies a rice mutant (*crw1*) that exhibits root coiling in hydroponics but normal gravitropic growth in soil. It is caused by a loss of function of the gene *COILING ROOT IN WATER 1 (CRW1)*, which encodes an OsEBF1 protein, which amplifies ethylene signaling. This signaling increases reactive oxygen species (ROS) at the root tip, affecting root tip stability, OsPIN2 polar localization, and auxin distribution, ultimately impairing gravitropism. However, mechanosensation induced by growth in soil or mechanical resistance generates calcium signaling that antagonizes the ethylene pathway, safeguarding gravitropism. The work reveals an unexpected interaction between ethylene, auxin, and mechanosensation in the control of plant gravitropism.",6
Cadaverine regulates biotin synthesis to modulate primary root growth in Arabidopsis,https://www.ncbi.nlm.nih.gov/pmc/articles/PMC8518694/,"cadaverine, regulates, biotin, synthesis, modulate, primary","study in *Arabidopsis thaliana* revealed that cadaverine, a polyamine, modulates root growth by inhibiting biotin biosynthesis. A genetic screen identified the *cadaverine hypersensitive 3* (cdh3) mutation, which confers cadaverine hypersensitivity and affects the BIO3-BIO1 gene, which is key in biotin production. The research demonstrated that cadaverine directly reduces BIO3-BIO1 activity and the biotinylation of essential proteins for fatty acid synthesis, such as BCCP1, thereby affecting lipid metabolism and root growth. Supplementation with biotin or its intermediates reversed this sensitivity, confirming the role of cadaverine as a regulator of the biotin pathway.",7
